{
  "atr_version": "0.1",
  "site": "bank.example",
  "task": "support.dispute_charge",
  "issued_at": "2026-07-02T12:00:00.000Z",
  "record_id": "atr_2222222222222222",
  "verdict": "handoff_required",
  "confidence": 0.74,
  "accessibility": {
    "reachable": true,
    "agent_hostility": "low",
    "success_rate": 0.18,
    "handoff_rate": "unknown",
    "blocked_rate": "unknown",
    "n": 31,
    "last_verified": "2026-07-01"
  },
  "safety": {
    "canonical": "unknown",
    "canonical_alternative": null,
    "domain_risk": "unknown",
    "notes": ["Financial dispute steps require a person to authorize each sensitive action."]
  },
  "freshness": {
    "median_evidence_age_days": 5,
    "surface_last_changed": null,
    "stale": false
  },
  "task_compatibility": {
    "supported": true,
    "expected_steps": "unknown",
    "recipe_available": false,
    "alternatives": []
  },
  "known_blockers": [
    {
      "kind": "human_handoff_required",
      "since": "2026-06-25",
      "n": 19,
      "persistent": true
    }
  ],
  "user_present": {
    "required": true,
    "reasons": ["human_handoff_required"],
    "irreversible_action": true
  },
  "agent_instruction": "Stop at the handoff boundary and ask the user to continue in the official channel.",
  "evidence": {
    "sources": {
      "public_web_observation": 11,
      "anonymous_report": 20
    },
    "canonical_url": "https://crawldex.com/sites/bank.example/support.dispute_charge",
    "dispute_url": "https://crawldex.com/disputes?record=atr_2222222222222222"
  },
  "publisher": {
    "claimed": false,
    "statement": null
  },
  "how_to_improve": "Publish a safe agent handoff route or submit fresh redacted evidence for this task."
}
